视频链接,发布日期,视频标题,观看次数,点赞次数,评论总数,作者名称,粉丝数量
https://www.youtube.com/watch?v=IpSXgPUwp3Q,2022年8月2日,Shark Tank Monster Hunter (game mobile),2,0,0,Dynamo_Lynn,1
https://www.youtube.com/watch?v=UZ-5YW6G8To,2022年8月1日,Top 15 best TACTIC Turn Based Games (High Graphic) RPG Strategy game for Android \u0026 iOS,1296,67,12,SHINN,32.6K
https://www.youtube.com/watch?v=oT_x93dgtZI,2022年8月2日,Monster Hunter (Android \u0026 iOS Game),69,3,0,SongzPlayGames!,10
https://www.youtube.com/watch?v=b1jzE-IqFDo,2022年8月2日,"Monster hunter rise rodando no Android, moto G200, snapdragon 888+, egg ns 3.0.6",43,3,1,Team Darkside,362
https://www.youtube.com/watch?v=vdSx2qfYGDY,2022年8月2日,COMO BAIXAR E INSTALAR O NOVO MONSTER HUNTER! PARA ANDROID IOS | MONSTER HUNTER MÓBILE,59,9,5,MetalSonicDude,31.9K
https://www.youtube.com/watch?v=8fgIaCVP0AE,2022年8月2日,FINALLY I HAVE FIRE NARGACUGA !! MONSTER HUNTER STORIES ANDROID GAMEPLAY,48,4,3,TheGlitchGuy_107,750
https://www.youtube.com/watch?v=8bQ1RcaZz9g,2022年8月2日,Monster Hunter Stories ,0,0,0,阿斯asu,19
https://www.youtube.com/watch?v=ojf2AbwciRo,2022年8月1日,Monster Hunter Mobile!? - Yeager,11,4,0,Dynamo_Lynn,409
https://www.youtube.com/watch?v=62225HZ8xY4,2022年8月1日,Monster Hunter Stories ,0,0,0,Msai,19
https://www.youtube.com/watch?v=cC1mfysxgS0,2022年8月1日,BATTLE BLACK STYGIAN ZINOGRE MONSTER HUNTER STORIES ANDROID GAMEPLAY,117,4,2,TheGlitchGuy_107,750
https://www.youtube.com/watch?v=00YoX79Wtic,串流播放日期：2022年7月31日,🔴Live monster hunter freedom Formando e Conversando,4,0,0,Vórtice Alternativo,37
https://www.youtube.com/watch?v=0khGfPzIMJ8,2022年8月2日,Monster Hunter Stories Gameplay Finishing Subquest at Monsonne Plain,9,10,9,Chandra Channel,1.41K
https://www.youtube.com/watch?v=3rmKECskMGk,2022年8月2日,Underwater Sea Monster Hunter - Best Sniping Game - Android Gameplay,126,0,0,大酱电影,43.1K
https://www.youtube.com/watch?v=9ljqVxBujfM,2022年7月31日,Monster Hunter Stories ,0,0,0,Dynamo_Lynn,19
https://www.youtube.com/watch?v=mWrIzP6hvsc,2022年7月31日,Monster Hunter (Gameplay Mobile Game Android \u0026 iOS),0,0,0,SongzPlayGames!,10
https://www.youtube.com/watch?v=1ZlrOCfQcFI,2022年8月2日,Monster Hunter Tri Wii Android Gameplay - Dolphin Wii Emulator - Mobile 2022,14,1,0,Weird Old Tech,3.33K
https://www.youtube.com/watch?v=ZqYuH8tAIZ4,2022年7月30日,Monster Hunter Stories Android Gameplay (Part 9: A Mysterious Rider),10,0,0,GeGaming Android,16
https://www.youtube.com/watch?v=wOfQt5ZMVtA,2022年7月30日,Monster Hunter Stories Android Gameplay (Part 8: The Forbidden Land),7,0,0,GeGaming Android,16
https://www.youtube.com/watch?v=BHXxIMySMgA,2022年7月30日,Monster Hunter Stories Android Gameplay (Part 6: Cheval and Lylia),14,0,0,GeGaming Android,16
https://www.youtube.com/watch?v=cCZzGiNH1PI,串流播放日期：2022年7月30日,Main Valo Sebelum Diblokir Bareng Kanjeng Aster ,71,13,0,Monchi Syakira Ch.,3.12K
https://www.youtube.com/watch?v=b40R3Q5YR5I,2022年7月30日,WHY YOU SHOULD TRY THIS BUILD MORE OFTEN NOW | HANZO BEST BUILD 2022,15,0,0,OZNAH,11.1K
https://www.youtube.com/watch?v=ikDBEkInHXQ,2022年7月30日,AFTER YOU KNOW YOUR ENEMY !! MONSTER HUNTER STORIES ANDROID GAMEPLAY,83,5,2,Yokai,750
https://www.youtube.com/watch?v=Yiyx8L3Ltho,2022年7月30日,monster game play android in 2022,43,0,0,GameMasterDhruv,340
https://www.youtube.com/watch?v=Mxgwa-hxGRc,2022年7月30日,Monster Hunter Stories Android Gameplay (Part 5: Chasing The Blue Bear),18,0,0,GeGaming Android,16
https://www.youtube.com/watch?v=VKdtD2RzfiI,2022年7月30日,Monster Hunter Stories Android Gameplay (Part 4: All in One Basket),16,0,0,GeGaming Android,16
https://www.youtube.com/watch?v=UCAejG0v-OU,0,0,0,0,0,0,0
https://www.youtube.com/watch?v=bqjZFf-ERac,2022年7月30日,Underwater Sea Monster Hunter - Best Sniping Game - Android Gameplay,384,1,0,大酱电影,43.1K
https://www.youtube.com/watch?v=I6qfT0Jp_aQ,2022年7月31日,Increase Your POWER get BEST ARMOR in the game \u0026 how to use Breakthrough Seals | Chimeraland Guide,939,79,66,TechGumbo,2.34K
https://www.youtube.com/watch?v=yBmqTBIbkEQ,2022年7月30日,Top 15 Best New Game Android High Graphic in English all kind of New Game's Type on Mobile,1891,84,18,Gamer Secret 玩家機密,32.6K
https://www.youtube.com/watch?v=DL59nzR4vWI,2022年7月29日,Wild Born ( 野境重生 ) - 初次试玩 “ 野境重生 ” !!! 最像 “ 魔物猎人 ” 的手游 ~ !!!,2,0,0,阿斯asu,109
https://www.youtube.com/watch?v=vvxj9nUNppA,串流播放日期：2022年7月28日,Livezinha Pokemon REMAKE | PATTE 2👑| Meta: 1k De Inscritos | Deixa O LIKE Na Live ! 😁👍,24,9,0,Lady Pipper,202
https://www.youtube.com/watch?v=vwiX8zPdRL4,2022年7月29日,Monster Hunter Freedom Unite PSP [Gameplay] Android,14,0,0,Dynamo_Lynn,30
https://www.youtube.com/watch?v=WIYadkmvUPo,2022年7月30日,COMO BAIXAR E INSTALAR MONSTER HUNTER MOBILE - SAIU MELHOR JOGO PARA ANDROID 2022,1241,30,29,Colecionando Pokemons,7.97K
https://www.youtube.com/watch?v=7pHloMt1M9Y,2022年7月28日,Top 12 Best MMORPG (most played) | (Most Popular) MMORPG online Games MMORPG Android iOS,5196,169,26,Gamer Secret 玩家機密,32.6K
https://www.youtube.com/watch?v=Uzbu22jkr9E,串流播放日期：2022年7月28日,Livezinha Pokemon REMAKE Mobile | PARTE 1👑 | Meta: 1k De Inscritos | Deixa O LIKE Na Live ! 😁👍,28,7,1,Vangakuz ヴァンガクズ,202
https://www.youtube.com/watch?v=SO8yRfe3pmM,2022年7月30日,Yeager: Hunter Legend - Monster Hunter Gameplay (Android),47,0,0,0utsiDer2522,2.29K
https://www.youtube.com/watch?v=NOLcGLFJv-8,2022年7月28日,GET STYGIAN ZINOGRE EGGS MONSTER HUNTER STORIES ANDROID GAMEPLAY,98,4,4,Yokai,750
https://www.youtube.com/watch?v=O9x_WiML2AY,2022年7月28日,Monster hunter 3rd Bertemu zinogre musuh tak diundang | mh3rdp,11,1,0,Silver Rathalos,21
https://www.youtube.com/watch?v=9rdSHgCATIU,2022年7月27日,Yeager Hunter Legends || New Android MMO || Monster Hunter Vibe! || Sneak peek || 60FPS Ultra ||,16,2,0,EishiiPlays,99
https://www.youtube.com/watch?v=n8xCTocXbDQ,2022年7月27日,Monster hunter stories. is interesting…,25,1,0,Ecchi No Secret,19
https://www.youtube.com/watch?v=VYv2kULfpYo,串流播放日期：2022年7月30日,A Journey Begins : Monster Hunter Stories 2: Wings Of Ruins,182,13,3,TheGlitchGuy_107,3.62K
https://www.youtube.com/watch?v=4cczF3W65WI,2022年7月29日,All In One Basket | Monster Hunter Stories #3,12,1,0,Team Darkside,1.09K
https://www.youtube.com/watch?v=mfgwJNYSm0s,2022年7月26日,tes game Monster Hunter xx Chitra emulator android realmi 5 Snapdragon 665,19,1,0,MHS,3
https://www.youtube.com/watch?v=lqduuftWKQA,2022年7月27日,CHEVAL X MALIKI PIETRU BOSS BATTLE MONSTER HUNTER STORIES ANDROID GAMEPLAY,282,9,6,GeGaming Android,750
https://www.youtube.com/watch?v=kT6jEATFV2U,2022年7月26日,Download Game Yeager Hunter Legend || Game Monster Hunter Terbaik di android dengan grafis pc,27,3,4,Doly Play,207
https://www.youtube.com/watch?v=OLaGQ7jcWbA,2022年7月26日,Monster Hunter Stories 2 Mobile Download ⭐️  How To Download For Free ⭐️ iOS + Android,186,2,1,freeCodeCamp.org,0
https://www.youtube.com/watch?v=4Qf8Lh2LX0c,2022年7月25日,Armas de las misiones de evento en Monster Hunter Freedom Unite MHFU,77,6,4,MetalSonicDude,114
https://www.youtube.com/watch?v=GuM6466uIuI,2022年7月26日,Memburu ARZUROS bos monster pertama | Monster hunter 3rd portable gameplay,22,4,0,Xieghit Gaming,21
https://www.youtube.com/watch?v=5TmBrizLMVo,2022年7月27日,Top 15 High Graphic Games PLAY TO EARN NFT Cryptocurrency Game can make Money for Android iOS Game,2835,90,41,Charger Games,32.6K
https://www.youtube.com/watch?v=l8Qgv1HJLLo,2022年7月25日,DOWNLOAD MONSTER HUNTER DI ANDROID YEAGER HUNTER LEGEND APK TERBARU 2022,26,2,4,CUTEFUL,732
https://www.youtube.com/watch?v=gPojXxzCLcw,2022年7月26日,Top 11 Best NEW idle Games with very nice gameplay and good Graphic idle games for Android iOS,2093,70,14,Gamer Secret 玩家機密,32.6K
https://www.youtube.com/watch?v=0armRSoYZoM,2022年7月26日,🤢 NOOB 😎 PRO 😈 HACKER | Monster Hunter | Download Play Store APK,68,0,0,Spike,5.75K
https://www.youtube.com/watch?v=PB23cUEwrDc,2022年7月24日,HOW to Evolve your PET | Chimeraland Guide,2441,85,50,ZakWylder,2.34K
https://www.youtube.com/watch?v=5JMxI2pWpnE,2022年7月25日,Monster Hunter Stories Gameplay Against Gendrome CS,49,24,73,Chandra Channel,1.41K
https://www.youtube.com/watch?v=JJ7QzLlqi68,2022年7月24日,SUPPORT ONLY MONSTER HUNTER STORIES ANDROID GAMEPLAY,70,4,6,Yokai,750
https://www.youtube.com/watch?v=gSgKZbuFRn4,2022年7月25日,Top 13 Best Offline \u0026 ONLINE  Multiplayer SURVIVAL Games for Android iOS (High Graphic),3063,124,19,Charger Games,32.6K
https://www.youtube.com/watch?v=3ve1HD1kRKk,2022年7月23日,KEREN BET DAH Nih Game ! Game Monster Hunter Mobile Terbaik - Yeager Hunter legend Indonesia,15938,572,102,愉悅的hehe11,3.1M
https://www.youtube.com/watch?v=XcdKquD18b8,2022年7月23日,Yeager: Hunter Legend Gameplay(Android) | Mobile Games 2022,12,0,0,Xiang,3.68K
https://www.youtube.com/watch?v=DFVgb-5THyg,0,0,0,0,0,0,0
https://www.youtube.com/watch?v=5hp4dTemmU4,2022年7月23日,17 KILLS!! 3 TOP TIER HEROES TOTALLY DESTROYED WITH MY HANZO,14,0,0,OZNAH,11.1K
https://www.youtube.com/watch?v=xeg7jBpchmc,2022年7月24日,Underwater Sea Monster Hunter - Best Sniping Game - Android Gameplay,2909,12,0,Typical Gameplay,43.1K
https://www.youtube.com/watch?v=BmgIODfyBQk,2022年7月25日,Underwater Sea Monster Hunter - Best Sniping Game - Android Gameplay,6131,29,1,Typical Gameplay,43.1K
https://www.youtube.com/watch?v=2A7dnCcEPbc,2022年7月24日,Top 15 Anime Games for 2 GB RAM | Best Anime Games for Low end Device Android iOS,2136,127,24,Charger Games,32.6K
https://www.youtube.com/watch?v=bxJdjSFMSY4,2022年7月23日,Baka!! II SHORTCHI #2【Vtuber  Indonesia】,31,0,0,Monchi Syakira Ch.,3.12K
https://www.youtube.com/watch?v=ZsB9Nk9CMt4,2022年7月23日,Top 15 Best OFFLINE Games with INSANE GRAPHIC for Android iOS You will love the Offline games,10161,396,34,Charger Games,32.6K
https://www.youtube.com/watch?v=J3hQbU9lmkc,2022年7月22日,How to connect Monster Hunter on ppsspp in any android device.,3,0,0,Dynamo_Lynn,34
https://www.youtube.com/watch?v=mVoahR22qKk,2022年7月22日,Game Mirip Monster Hunter Tapi Di Mobile! Yeager Hunter Legend (Android/iOS),3208,138,35,Gamer Secret 玩家機密,373K
https://www.youtube.com/watch?v=4iu8ZFZQ4L0,2022年7月22日,Yeager: Hunter Legend [Chimera Destroyer Expedition Run],40,0,0,Greed,34
https://www.youtube.com/watch?v=chmxNbQ9_wI,2022年7月22日,GET ETERNAL STRIFE WEAPONS FROM AVINIA MONSTER HUNTER STORIES ANDROID GAMEPLAY,147,4,2,Yokai,750
https://www.youtube.com/watch?v=nIFtNe_2xck,2022年7月23日,Open Night Market Valorant II SHORTCHI #1【Vtuber  Indonesia】,38,6,1,Monchi Syakira Ch.,3.12K
https://www.youtube.com/watch?v=MR9Hk5dYZyk,0,0,0,0,0,0,0
https://www.youtube.com/watch?v=VO-zcBW67x4,2022年7月22日,Top 12 High Graphic Best ANIME GAMES Android iOS (Anime action RPG Turn based RPG Anime MMORPG),8093,232,22,Charger Games,32.6K
https://www.youtube.com/watch?v=kQ_xhfo-WaA,2022年7月21日,Monster Hunter Stories 1 (mobile) Part 2 A NEW RIDER IS BORN!,33,6,0,TheGlitchGuy_107,22
https://www.youtube.com/watch?v=0jelvdcuR8E,2022年7月22日,how to download monster Hunter stories free on android phone,63,4,0,Jenifer Ybarola,6
https://www.youtube.com/watch?v=7gLBBHLDlxc,2022年7月22日,PLAYING HIDE AND SEEK - HANZO x NATALIA CAMPER BE LIKE,19,0,0,OZNAH,11.1K
https://www.youtube.com/watch?v=XLAfLp4731c,已於 2022年7月21日首播,17 KILLS!! HANZO ONE HIT DELETE BUILD YOU SHOULD TRY,8,0,0,OZNAH,11.1K
https://www.youtube.com/watch?v=upVh5V0xvKs,2022年7月22日,Is This The Strongest Caveman Evolution? (Monster Hunter),5018,227,14,Fady,594K
https://www.youtube.com/watch?v=JXND66TQz1M,2022年7月21日,Rangers of Oblivion - Episode 19,25,0,8,Stanford Online,369
https://www.youtube.com/watch?v=bpwoRB-8B0I,2022年7月20日,Yeager: Hunter Legend - Monster Hunter Style Mobile Action RPG Game,14,1,0,0utsiDer2522,154
https://www.youtube.com/watch?v=KRRAd1n0v84,串流播放日期：2022年7月21日,Diablo Immortal [Gorgothra] Totmenta 3 - Conferindo Atualização,46,13,3,Lady Pipper,202
https://www.youtube.com/watch?v=aTkWmOr50Wk,2022年7月21日,Akhirnya Official Rilis - Monster Hunter Mobile ?? Wild Born (Android),16,1,0,IGN,3
https://www.youtube.com/watch?v=5ThM3MhrXpA,2022年7月20日,DOWNLOAD YEAGER HUNTER LEGEND ANDROID GRAFIK JOSSSS | Monster Hunter Versi Android,217,7,4,Gamer Secret 玩家機密,1.75K
https://www.youtube.com/watch?v=Kgce22LFV5A,已於 2022年7月21日首播,DOUBLE B.O.B W BULA SNS X GUNLANCE (CHAD PLAY),11,1,0,Kaiju Killer,8
https://www.youtube.com/watch?v=majYN9oeMpk,2022年7月21日,Top 13 Best PORTRAIT Games RPG on Android iOS | Top Portrait games you Must Play on Mobile.,2909,80,13,阿斯asu,32.6K
https://www.youtube.com/watch?v=X3UTMZopXHE,2022年7月20日,How To Download And Open Yeager : Hunter legend In Any Android | ✅ Direct Download Link in Desc.,172,3,0,AxeDroidPlayz,4
https://www.youtube.com/watch?v=-3hjT6XG1jE,2022年7月20日,MONSTER HUNTER STORIES MOD APK TERBARU 2022 MOD MENU,351,5,8,the force,732
https://www.youtube.com/watch?v=ntkoiw1uieI,2022年7月20日,Top 15 Best Pixel Art Games for Android iOS (HIDDEN Pixel games NOSTALGIC pixel Art games CHILDHOOD),3574,129,33,Charger Games,32.6K
https://www.youtube.com/watch?v=hAPan9Z9x3I,2022年7月19日,Top 14 Best NEW GAMES for Android iOS 2022 in (HIGH GRAPHIC) New games (ONLINE / OFFLINE) HD games,2915,135,14,Charger Games,32.6K
https://www.youtube.com/watch?v=p8DJ7Yzf27E,已於 2022年7月22日首播,24 KILLS!! TARGET LOCKED (HANABI) 😂😂😂 | LEGENDARY GAMEPLAY,14,0,0,OZNAH,11.1K
https://www.youtube.com/watch?v=SdnaNzr3fZs,串流播放日期：2022年7月19日,Tidak Boleh Maeeen Sleding!!! 【Vtuber Indonesia】,37,9,0,Monchi Syakira Ch.,3.12K
https://www.youtube.com/watch?v=luKK34YJNR0,2022年7月20日,REVENGE TO RATHIAN MONSTER HUNTER STORIES ANDROID GAMEPLAY,100,10,4,Yokai,750
https://www.youtube.com/watch?v=kEU2F0DqoCM,2022年7月19日,Yeager: Hunter Legend - Ultra Graphics Experience | OBT Gameplay (Android/IOS) Walkthrough,9,2,1,ScissorsBox,4
https://www.youtube.com/watch?v=eNLS44KRvq4,2022年7月20日,🤣🤣kelaa challenge for free fir 💥💥,6,0,0,The gURU GAMERex,68
https://www.youtube.com/watch?v=iLtztKlcNmU,2022年7月19日,HOW to LEVEL UP Your Character Super Fast | Chimeraland,1706,65,58,ZakWylder,2.34K
https://www.youtube.com/watch?v=gY9pZ3iUD5c,2022年7月20日,Yeager: Hunter Legend APK | ultra GRÁFICOS| Beta2 Monster Hunter MOBILE (Android/iOS),487,2,0,凡人遊戲,1.92K
https://www.youtube.com/watch?v=2P_9gFcHxac,2022年7月19日,rhatian mati karena kucing 🐱 monster Hunter xx android on Chitra emulator,47,1,1,Rakuen C13,3
https://www.youtube.com/watch?v=F0mjbQ2EUBc,2022年7月19日,"Monster Hunter Trailer (Android, IOS) ",97,6,0,MITs GamerX,317K
https://www.youtube.com/watch?v=8eQiZC3GZs4,2022年7月21日,APTONOTH LEVEL 99 VS SEREGIOS HIGH RANK MONSTER HUNTER STORIES ANDROID GAMEPLAY,107,3,0,Alan Becker,750
https://www.youtube.com/watch?v=mAd0LztGRHI,2022年7月19日,SPRINT - MUST TRY SPELL FOR HANZO,16,1,1,OZNAH,11.1K
https://www.youtube.com/watch?v=OkEc4fFaWxk,串流播放日期：2022年7月18日,🔴Live monster hunter freedom Formando e Conversando,28,4,3,Schrade Academy,37
https://www.youtube.com/watch?v=YLtjKcQv5Bk,2022年7月18日,Top 13 Best ROGUELIKE games Android | Top Roguelite RPG games for Mobile iOS,4001,136,22,Charger Games,32.6K
https://www.youtube.com/watch?v=wVM8ZhNAdGo,2022年7月19日,怪物猎人崛起免费下载PC和Android手机,40,1,0,Dynamo_Lynn,950
https://www.youtube.com/watch?v=2M7UIId3m54,2022年7月19日,GAME DIGIMON ANDROID Resmi - Digimon New Generation Free Gacha gameplay,14556,0,58,SHINN,125K
https://www.youtube.com/watch?v=DbRR1XMJuCg,2022年7月18日,Monster Hunter Portable 3rd on PPSSPP android - EP1,112,6,1,MonZy PH,7.42K
https://www.youtube.com/watch?v=QBp3PweKC7w,串流播放日期：2022年7月17日,Bertemu Gadis Yang Kawaiiiii【Vtuber Indonesia】,71,17,0,Monchi Syakira Ch.,3.12K
https://www.youtube.com/watch?v=Ou2YZy1v1V0,2022年7月18日,Monster Hunter Stories 2: Wing Of Ruin part 2 ,4,0,0,阿斯asu,203
https://www.youtube.com/watch?v=PVkO49jt9GM,0,0,0,0,0,0,0
https://www.youtube.com/watch?v=1rHEs2rLDqQ,2022年7月19日,"Monster Hunter Gameplay Walkthrough #1 (Android, IOS)",1007,2,0,Siddharth Gamer,317K
https://www.youtube.com/watch?v=FX8N59gfkOY,2022年7月18日,Yeager(Monster Hunter Android) Gameplay 5,10,0,0,Dynamo_Lynn,37
https://www.youtube.com/watch?v=I0scPJNXm-4,2022年7月19日,GET GREAT SWORD SKILL MONSTER HUNTER STORIES ANDROID GAMEPLAY,145,5,10,catrazilla,750
https://www.youtube.com/watch?v=A90yofSCzzo,2022年7月18日,"Обзор Yeager: Hunter Legend | Новая ARPG без автобоя в стиле Monster Hunter (Android, IOS)",841,11,5,Dynamo_Lynn,86
https://www.youtube.com/watch?v=27-gkT3dSuk,2022年7月17日,monster Hunter 3rd android ppsspp emulator,28,2,0,MHS,3
https://www.youtube.com/watch?v=m3Ska4YzNik,串流播放日期：2022年7月8日,MOBILE LEGENDS X MONSTER HUNTER RISE: SUNBREAK INDONESIA #18,7495,381,0,抖音流行歌曲,81.2K
https://www.youtube.com/watch?v=6ZCC94WygKo,2022年7月17日,Yeager(Monster Hunter Android) Gameplay 4,11,1,0,Dynamo_Lynn,37
https://www.youtube.com/watch?v=Tf3qef2CN1s,2022年7月18日,Yeager Hunter Legend on PC W/ Controller \u0026 GIVEAWAY!!!,381,11,8,Serigalo Terbeyy,7.64K
https://www.youtube.com/watch?v=ukl_0WJwp4o,2022年7月17日,Yeager hunter legend android | Yeager hunter legend | Yeager hunter legend apk download | Yeager ios,15,1,0,UploadVR,3
https://www.youtube.com/watch?v=4A5HHnFxSAc,2022年7月18日,SKYLORD AZURE \u0026 RATHALOS MONSTER HUNTER STORIES ANDROID GAMEPLAY,150,7,2,catrazilla,750
https://www.youtube.com/watch?v=YH74AzpGzSs,2022年7月17日,"Yeager Hunter Legend Gameplay - 2,  Yeager Hunter Legend Mobile,Yeager Hunter Legend Mobile Gameplay",11,1,2,Pop boy,596
https://www.youtube.com/watch?v=p56_8OGI41k,2022年7月16日,Yeager: Hunter Legend Gameplay | Yeager Hunter Legend Play in low end device | Yeager Hunter Legend,26,1,0,BISWA GAMER,4.3K
https://www.youtube.com/watch?v=fVeFXjd4xjI,2022年7月16日,Monster Hunter Freedom Unite PSP (Gameplay HD)PPSSPP,105,1,1,Rakuen C13,922
https://www.youtube.com/watch?v=_eMmIZ-n3jI,2022年7月17日,FULL OFFLINE - Jet Lee Rise Of Honor Gameplay Android \u0026 PC Best setting,1897,37,15,Atarashi Nezumi,125K
https://www.youtube.com/watch?v=l9ORwoyc450,2022年7月16日,Yeager: Hunter Legend Android Gameplay (2022) | Ultimate Graphics Settings | Rog Phone 5,697,21,7,SHINN,44K
https://www.youtube.com/watch?v=2YBjNWPQ88k,2022年7月16日,Top 13 Mobile FPS games like CSGO can play Multiplayer FPS Offline \u0026 ONLINE FPS game Android iOS,4037,179,14,Charger Games,32.6K
https://www.youtube.com/watch?v=0RiNscIX0aI,2022年7月16日,"YEAGER Indonesia , Monster Hunter Alternativ Android ",24,5,5,Ulint Eazy,147
https://www.youtube.com/watch?v=41fgTYzmdaQ,2022年7月16日,GET SKILL SWORD \u0026 SHIELD MONSTER HUNTER STORIES ANDROID GAMEPLAY,227,6,6,Yokai,750
https://www.youtube.com/watch?v=hZw_-nwc98g,2022年7月16日,"Yeager: Hunter Legend Gameplay | Yeager Hunter Legend Play In 4GB Ram Device, Download Yeager Hunter",21,1,0,Charger Games,596
https://www.youtube.com/watch?v=qoGnNKEsoPY,2022年7月17日,"Yeager Hunter Legend Gameplay - 2, How to download Yeager Hunter Legend Mobile,Yeager Hunter Legend",9,2,0,BISWA GAMER,4.3K
https://www.youtube.com/watch?v=ZHSsUVUyXbo,2022年7月16日,NO AUTO Monster Hunter ARPG Versi Android - YEAGER : Hunter Legend Mobile,12,1,0,CibXD,8
https://www.youtube.com/watch?v=BZAVP7O5eV0,2022年7月16日,MONSTER HUNTER PARA CELULAR!? | YEAGER HUNTER LEGEND GAMEPLAY  [OPEN BETA] - GRAFICOS ULTRA (2022),8,0,0,4Player Network,641
https://www.youtube.com/watch?v=YEM2EQ9jf3c,串流播放日期：2022年7月16日,1 Crown = Nyanyi 1 Lagu ll Game Ini Mirip Stumble Guys【Vtuber Indonesia】,69,20,1,USTP PPD KINTA UTARA,3.12K
https://www.youtube.com/watch?v=w7SR6WsnZLM,2022年7月15日,Yeager(Monster Hunter Android) Gameplay 2,10,2,0,0utsiDer2522,37
https://www.youtube.com/watch?v=R_w7UwdeXds,0,0,0,0,0,0,0
https://www.youtube.com/watch?v=5ct4Vxx-C3E,2022年7月16日,Finally can Play Monster Hunter Mobile !! Yeager Hunter Legend Download APK,297,10,12,Heavy Wings,10.3K
https://www.youtube.com/watch?v=4thFvWtlnmI,2022年7月15日,Gaming Test Yeager Monster Hunter Mobile OBT Redmi Note 10S Juli 2022,15,0,4,RIANDESU,15
https://www.youtube.com/watch?v=pPTOKCRA_Ao,2022年7月16日,Yeager: Hunter Legends - Android Gameplay Part 1 | Monster Hunter Mobile,129,5,1,Serigalo Terbeyy,6.89K
https://www.youtube.com/watch?v=blcl5uSlBmo,2022年7月16日,MENOLAK DEADGAME - LEGEND OF ACE UPDATE TERUS,2772,75,31,Auberon Wizonix,125K
https://www.youtube.com/watch?v=tJgMe8D_Lyo,2022年7月15日,SAIU INCRÍVEL RPG ESTILO MONSTER HUNTER PARA ANDROID - YEAGER HUNTER LEGEND | (BETA) - GAMEPLAY!!,34,3,1,阿斯asu,172
https://www.youtube.com/watch?v=7TiboSV7R9Q,0,0,0,0,0,0,0
https://www.youtube.com/watch?v=ZbMb8zB6pUw,2022年7月15日,NOVO JOGO ESTILO MONSTER HUNTER - YEAGER ANDROID - FAZENDO PURGATORIO,58,3,2,Sableng,60
https://www.youtube.com/watch?v=SAYSIqdFUkE,2022年7月15日,Top 13 Best Graphic MMORPG Android Games | Top MMORPG game for Android iOS MMORPG most played Mobile,5378,151,40,阿斯asu,32.6K
https://www.youtube.com/watch?v=-Cf0wIcuIXo,已於 2022年7月14日首播,Yeager: Hunter Legend || OBT - RPG Gameplay (Android/IOS),20,0,0,Dynamo_Lynn,1.18K
https://www.youtube.com/watch?v=r07si_gL_w8,串流播放日期：2022年7月15日,MMORPG Monster Hunter Mobile CUK!!! Maen di PC Yeager Server Kanada,1390,34,7,Yuya Dara,13.9K
https://www.youtube.com/watch?v=51szBpLgt8U,2022年7月15日,YEAGER HUNTER - LA MEJOR COPIA DE MONSTER HUNTER EN MOBILE | YEAGER HUNTER LEGEND,669,31,5,Drew,18.6K
https://www.youtube.com/watch?v=_upnRdz7rck,2022年7月14日,Top 13 Best MMORPG android game Open world with Chibi style | Best Chiby MMORPG cute design games,4024,119,23,阿斯asu,32.6K
https://www.youtube.com/watch?v=JjhxJp3KWQ8,0,0,0,0,0,0,0
https://www.youtube.com/watch?v=r2IAS88fPxw,2022年7月14日,Yeager(Monster Hunter Android) Gameplay 1,30,2,0,STEVE MACHETE,37
https://www.youtube.com/watch?v=DABFJmls5hM,2022年7月14日,Game Android Mirip Monster Hunter | Yeager: Hunter Legend - Main di Helio G85,81,1,2,0utsiDer2522,4
https://www.youtube.com/watch?v=OzatEz0AvQY,2022年7月15日,"CONHEÇA YEAGER, O NOVO MONSTER HUNTER!  (MOBILE E SEM AUTOMÁTICO PARA ANDROID E IOS) 👾⚔️",6545,498,101,Caverna do Game,66.1K
https://www.youtube.com/watch?v=S9uFWib36Xg,2022年7月14日,new games for android 2022 yeager hunter legend,112,7,4,NEW GAMES ANDROID,627
https://www.youtube.com/watch?v=zN0kOCWx41o,2022年7月15日,EASY GET BUTTERFLY ARMOR MONSTER HUNTER STORIES ANDROID GAMEPLAY,112,7,9,XxBioluminescence DragonxX,750
https://www.youtube.com/watch?v=hX0FiKFTjgw,2022年7月14日,YEAGER : HUNTER LEGEND - OPEN BETA TEST GAMEPLAY (ANDROID) | BEST MONSTER HUNTER GAME,56,1,4,Dynamo_Lynn,4.49K
https://www.youtube.com/watch?v=A8318esoY58,串流播放日期：2022年7月14日,[LIVE] Game Ini Sempat Kumainin Di Android || Monster Hunter Stories 2,45,2,0,Kominato Kin,89
https://www.youtube.com/watch?v=C2DHYqUYjlg,已於 2022年7月14日首播,MONSTER HUNTER VERSI MOBILE ( OBT NOW ) ALL WEAPON - YEAGER HUNTER LEGEND ( PC - MOBILE ),823,14,7,Serigalo Terbeyy,33.2K
https://www.youtube.com/watch?v=rBN4YSqmuxs,0,0,0,0,0,0,0
https://www.youtube.com/watch?v=irqBjjKtVTU,已於 2022年7月14日首播,YEAGER SAIU NOVO JOGO ESTILO MONSTER HUNTER PARA ANDROID - BETA,357,53,1,ET UNKNOWN,48.5K
https://www.youtube.com/watch?v=MjdEl4OBLJQ,2022年7月14日,Yeager: Hunter Legend Test Poco X3 Pro Gameplay Android,13,0,0,Lacker Fish Black,0
https://www.youtube.com/watch?v=mXcuQxg-8eI,2022年7月14日,The Real MONSTER HUNTER Android - YEAGER,127,7,6,Alan Becker,11.5K
https://www.youtube.com/watch?v=OrUAqLqah-o,2022年7月14日,AKHIRNYA GAME MONSTER HUNTER VERSI ANDROID RILIS! Review Yeager: Hunter Legend,9321,286,76,愉悅的hehe11,755K
https://www.youtube.com/watch?v=o5e6G3bgd0c,2022年7月14日,YEAGER: Hunter Legend Gameplay Mobile - Monster Hunter Like ARPG (Android Version) Gameplay Part 2,15,0,0,Dynamo_Lynn,983
https://www.youtube.com/watch?v=AaxVxky9sm8,2022年7月14日,*NEW ARPG* YEAGER: Hunter Legend Gameplay ,31,7,2,ScissorsBox,525
https://www.youtube.com/watch?v=HjRf8EGNxJo,2022年7月14日,"YEAGER : HUNTER LEGEND ULTRA GRAPHICS GAMEPLAY MONSTER HUNTER MOBILE (Android,iOS)",28,2,0,Dragnion Mobile,21
https://www.youtube.com/watch?v=l5AGhsujieY,已於 2022年7月14日首播,"YEAGER HUNTER legends, SAIU INCRÍVEL RPG ESTILO MONSTER HUNTER PARA ANDROID GAMEPLAY Full gráficos",172,18,7,阿斯asu,40K
https://www.youtube.com/watch?v=uE1c6pBY7Sc,2022年7月14日,"Yeager: Hunter Legends - Only Gameplay [Eidolon Spears], Insect Glaive Less Jump motion",46,1,0,Dynamo_Lynn,401
https://www.youtube.com/watch?v=JFiDMpYX0e0,2022年7月13日,Top 15 Best Side Scrolling Android Games | Most looking Side scrolling Action RPG games Mobile,3698,139,12,Charger Games,32.6K
https://www.youtube.com/watch?v=nH9k8a9dWBA,2022年7月14日,"[신작 모바일게임] 판타지 어드벤처 3D 액션 RPG 게임, '예거: 헌터 레전드' 플레이. 외계 생물 몬스터 헌터 액션 모바일 MMORPG 게임 (출시예정 모바일게임)",408,4,2,노마드 코더 Nomad Coders,4.92K
https://www.youtube.com/watch?v=tEFJ1rutSWU,2022年7月14日,Yeager [EN] - New Monster Hunting Game Released! Just Like Monster Hunter for Mobile Android!,224,10,7,DeepanshuCODYT,22.4K
